{
  "schemaVersion": "forge.m5.selector-repair-materialization-case/v1",
  "caseId": "historical-suite-repair",
  "suiteAuthority": {
    "projectId": "m5-selector-repair",
    "suiteId": "suite-11111111-1111-4111-8111-111111111111",
    "revision": 3,
    "contentHash": "e9622bd58ac39310994fdb7692f8ed6e3428e56b63a3a520c7a1fc80017c70cf",
    "itemOrdinal": 2,
    "membership": {
      "testSetId": "test-set-v3-7c568c867a2989a6b842e917",
      "testSetRevision": 7,
      "testSetContentHash": "39e09f90d228eeac6d4361e77c3e3f59700647dc981c6ff51a3ce0c31a6181b0",
      "definitionId": "test-v3-flow-14b286921056c7a91cb10523"
    }
  },
  "persistedSuiteAuthority": {
    "schemaVersion": 2,
    "suiteId": "suite-11111111-1111-4111-8111-111111111111",
    "projectId": "m5-selector-repair",
    "revision": 3,
    "name": "Historical selector repair suite",
    "purpose": "sanity",
    "members": [
      {
        "ordinal": 1,
        "definitionAuthority": {
          "testSetRowId": 700,
          "definitionId": "test-v3-flow-unrelated",
          "definitionSchemaVersion": 3,
          "testSetId": "test-set-v3-unrelated",
          "testSetRevision": 1,
          "testSetContentHash": "9999999999999999999999999999999999999999999999999999999999999999"
        }
      },
      {
        "ordinal": 2,
        "definitionAuthority": {
          "testSetRowId": 701,
          "definitionId": "test-v3-flow-14b286921056c7a91cb10523",
          "definitionSchemaVersion": 3,
          "testSetId": "test-set-v3-7c568c867a2989a6b842e917",
          "testSetRevision": 7,
          "testSetContentHash": "39e09f90d228eeac6d4361e77c3e3f59700647dc981c6ff51a3ce0c31a6181b0"
        }
      }
    ],
    "createdAt": "2026-09-03T13:00:00.000Z",
    "provenance": {
      "source": "product_api",
      "changeKind": "revised",
      "priorRevision": 2,
      "changeIntentKey": "suite-change-historical-3",
      "changeIntentFingerprint": "8888888888888888888888888888888888888888888888888888888888888888"
    },
    "contentHash": "e9622bd58ac39310994fdb7692f8ed6e3428e56b63a3a520c7a1fc80017c70cf"
  },
  "sourceTestSet": {
    "schemaVersion": 3,
    "testSetId": "test-set-v3-7c568c867a2989a6b842e917",
    "revision": 7,
    "projectId": "m5-selector-repair",
    "generationId": "generation-source",
    "generatedAt": "2026-09-03T12:00:00.000Z",
    "generationMethod": "deterministic",
    "outcome": "completed",
    "canonicalSupport": {
      "modelRowId": 41,
      "modelVersion": "1.0.0",
      "observationRunId": "observation-run-m1",
      "supportSealHash": "aaaaaaaaaaaaaaaaaaaaaaaaaaaaaaaaaaaaaaaaaaaaaaaaaaaaaaaaaaaaaaaa",
      "characterizationPolicy": {
        "id": "forge.crawl-observation-characterization",
        "version": "1"
      },
      "supportingObservationIds": [
        "obs-cart-m1",
        "obs-checkout-m1"
      ],
      "supportingGapIds": []
    },
    "definitions": [
      {
        "id": "test-v3-flow-14b286921056c7a91cb10523",
        "title": "Direct checkout from cart: Cart to Checkout information",
        "intent": "Reach checkout-html through the directly observed cart-html:checkout interaction.",
        "canonicalSubjects": [
          "cart-html",
          "checkout-html"
        ],
        "provenance": {
          "modelRowId": 41,
          "modelVersion": "1.0.0",
          "supportSealHash": "aaaaaaaaaaaaaaaaaaaaaaaaaaaaaaaaaaaaaaaaaaaaaaaaaaaaaaaaaaaaaaaa",
          "subjectSupport": [
            {
              "canonicalSubjectId": "cart-html",
              "supportingObservationIds": [
                "obs-cart-m1"
              ],
              "supportingGapIds": []
            },
            {
              "canonicalSubjectId": "checkout-html",
              "supportingObservationIds": [
                "obs-checkout-m1"
              ],
              "supportingGapIds": []
            }
          ],
          "intentId": "intent-v1-b59536e7482f9de8982e8551",
          "intentContentHash": "bb7460cd923d06c176d983d6d33fbd03f3ba72ce428d3643f05813d7aa271fc5"
        },
        "appArea": "Cart",
        "normalizedIntent": {
          "appArea": {
            "confidence": "medium",
            "evidenceIds": [
              "cart-html"
            ],
            "id": "Cart",
            "method": "rule",
            "sourceSubjectId": "cart-html"
          },
          "disposition": {
            "state": "supported"
          },
          "evidenceAssessment": {
            "limitations": [
              "Source flow steps 1 were excluded and are not executable M1 semantics.",
              "The source flow is partial; only the directly observed selected transition is runnable."
            ],
            "selectedStepGrounding": "observed",
            "sourceFlowConfidence": "partial",
            "state": "sufficient"
          },
          "expectedOutcomes": [
            {
              "kind": "subject_observable",
              "outcomeId": "intent-outcome-0167ac59bb506ede92b43062",
              "routePath": "/checkout.html",
              "subjectId": "checkout-html"
            }
          ],
          "grounding": {
            "excludedFlowStepIndexes": [
              1
            ],
            "modelRowId": 41,
            "modelVersion": "1.0.0",
            "observationRunId": "observation-run-m1",
            "selectedFlowStepIndexes": [
              2
            ],
            "sourceFlowId": "direct-checkout",
            "subjectSupport": [
              {
                "canonicalSubjectId": "cart-html",
                "supportingGapIds": [],
                "supportingObservationIds": [
                  "obs-cart-m1"
                ]
              },
              {
                "canonicalSubjectId": "checkout-html",
                "supportingGapIds": [],
                "supportingObservationIds": [
                  "obs-checkout-m1"
                ]
              }
            ],
            "supportSealHash": "aaaaaaaaaaaaaaaaaaaaaaaaaaaaaaaaaaaaaaaaaaaaaaaaaaaaaaaaaaaaaaaa"
          },
          "intentId": "intent-v1-b59536e7482f9de8982e8551",
          "objective": "Reach checkout-html through the directly observed cart-html:checkout interaction.",
          "preconditions": [
            {
              "kind": "authenticated_role",
              "mechanism": "form-login",
              "roleId": "standardUser"
            }
          ],
          "projectId": "m5-selector-repair",
          "schemaVersion": "forge-normalized-test-intent/v1",
          "source": "discovered",
          "steps": [
            {
              "kind": "navigate_to_observed_route",
              "ordinal": 0,
              "routePath": "/cart.html",
              "stepId": "intent-step-12de687a21696014d7426147",
              "subjectId": "cart-html"
            },
            {
              "dataTestValue": "checkout-old",
              "elementId": "cart-html:checkout",
              "kind": "click_observed_data_test",
              "ordinal": 1,
              "stepId": "intent-step-dc78bf3b6471a8b7dd760f52",
              "subjectId": "cart-html",
              "targetSubjectId": "checkout-html"
            }
          ],
          "title": "Direct checkout from cart: Cart to Checkout information"
        },
        "flowRouteEvidence": [
          {
            "subjectId": "cart-html",
            "normalizedPath": "/cart.html",
            "normalizationPolicy": {
              "id": "forge.canonical-route-normalization",
              "version": "1"
            },
            "supportingObservationIds": [
              "obs-cart-m1"
            ]
          },
          {
            "subjectId": "checkout-html",
            "normalizedPath": "/checkout.html",
            "normalizationPolicy": {
              "id": "forge.canonical-route-normalization",
              "version": "1"
            },
            "supportingObservationIds": [
              "obs-checkout-m1"
            ]
          }
        ],
        "authenticationExpectation": {
          "state": "required",
          "mechanism": "form-login",
          "bases": [
            {
              "kind": "declared_configuration",
              "policyId": "forge.authentication-expectation.declared-configuration",
              "policyVersion": "1",
              "configurationDigest": "cccccccccccccccccccccccccccccccccccccccccccccccccccccccccccccccc",
              "mechanism": "form-login"
            }
          ]
        },
        "actions": [
          {
            "kind": "navigate_to_observed_route",
            "ordinal": 0,
            "routePath": "/cart.html",
            "stepId": "intent-step-12de687a21696014d7426147",
            "subjectId": "cart-html"
          },
          {
            "dataTestValue": "checkout-old",
            "elementId": "cart-html:checkout",
            "kind": "click_observed_data_test",
            "ordinal": 1,
            "stepId": "intent-step-dc78bf3b6471a8b7dd760f52",
            "subjectId": "cart-html",
            "targetSubjectId": "checkout-html"
          }
        ],
        "oracle": {
          "kind": "subject_observable",
          "subjectId": "checkout-html",
          "supportingObservationIds": [
            "obs-checkout-m1"
          ],
          "explanation": "Observe the sealed target subject at its governed final route after the directly observed click transition."
        },
        "generationMethod": "deterministic",
        "validation": {
          "state": "valid",
          "explanation": "The definition embeds one immutable normalized intent whose selected click is directly observed and exactly sealed."
        },
        "runnerCompatibility": {
          "state": "compatible",
          "explanation": "The definition's steps, oracle, and authentication setup are all supported."
        },
        "confidenceLimitations": [